{
    "$schema": "https://json-schema.org/draft/2020-12/schema",
    "$id": "https://pushword.piedweb.com/schema/carousel.json",
    "title": "Pushword Repurpose Carousel",
    "description": "A social-media post derived from a Pushword page, stored as one JSON file per (page, network) and rendered to self-contained SVG slides. The Symfony Validator on the Carousel model is the source of truth; this schema mirrors it as an authoring aid. Cross-field rules it enforces but this schema only hints at: `format` must be one the `network` accepts (see /api/repurpose/networks); slide count and published caption length (caption plus hashtags) must stay within the network's hard limits; Pinterest requires one slide and a non-empty caption; each slide must show at least one text field or a background image; a text overlay only applies over an image. Colours and fonts left unset inherit the site's own design tokens.",
    "type": "object",
    "required": ["page", "network", "format", "slides"],
    "additionalProperties": false,
    "properties": {
        "page": { "type": "string", "description": "The source page, addressed by its slug (host is the containing folder)." },
        "network": { "enum": ["linkedin", "instagram", "facebook", "pinterest", "threads", "youtube", "tiktok", "x", "deck"], "description": "Target platform; selects the publishing rules (allowed formats, limits, export kind)." },
        "format": { "enum": ["linkedin-4-5", "linkedin-1-1", "instagram-4-5", "instagram-3-4", "instagram-1-1", "story-9-16", "threads-4-5", "facebook-1-1", "pinterest-2-3", "x-16-9", "x-1-1", "deck-16-9"], "description": "Output size; must be allowed for the chosen network." },
        "template": { "enum": ["editorial"], "default": "editorial", "description": "Slide template family." },
        "status": { "enum": ["draft", "planned", "posted"], "default": "draft" },
        "plannedAt": { "type": ["string", "null"], "description": "Parseable date-time when the post is scheduled, or null." },
        "caption": { "type": ["string", "null"], "description": "The post caption. Its published length, including hashtags, is capped per network; Pinterest requires a non-empty caption." },
        "video": { "type": ["string", "null"], "pattern": "^[a-zA-Z0-9_.-]+\\.(?:[mM][pP]4|[wW][eE][bB][mM])(?![\\s\\S])", "description": "Normalized filename of a rendered MP4 or WebM in the media library. The admin plays this render; editing slides does not regenerate it." },
        "audio": { "$ref": "#/$defs/audioMix", "description": "Independent voice and looping music for new video exports. Does not change an already imported rendered video." },
        "hashtags": { "type": "array", "items": { "type": "string" } },
        "palette": { "$ref": "#/$defs/palette", "description": "Deck-level colour override; any slide may override again." },
        "fontPairing": { "type": ["string", "null"], "description": "A key from the font-pairing registry (see /api/repurpose/networks, fontPairings). Only pick a pairing whose `installed` is true — an uninstalled one silently falls back to Roboto; `pw:repurpose:fonts <pairing>` installs the missing TTFs. Null inherits site typography." },
        "counter": { "$ref": "#/$defs/counter" },
        "background": { "enum": ["none", "dots", "rings", "waves", "scales", "chevron", "hexagon", "triangles", "plus", "diamonds", "memphis", "sketchy", "paper"], "default": "none", "description": "Deck-wide decorative effect, authored once and sliced across every slide so a shape continues over a swipe. A slide may override it." },
        "creator": {
            "type": ["string", "object", "null"],
            "description": "A creator key from the site's repurpose_creators config (an unknown key falls back to the brand and raises a warning listing the known keys), or an inline object for a one-off byline. Null shows the brand.",
            "properties": {
                "name": { "type": "string" },
                "role": { "type": ["string", "null"] },
                "avatar": { "type": ["string", "null"], "description": "A media file name; missing or absent renders an initials disc instead." },
                "type": { "enum": ["personal", "business"], "default": "personal" }
            },
            "required": ["name"],
            "additionalProperties": false
        },
        "creatorOrientation": { "enum": ["horizontal", "vertical"], "default": "horizontal", "description": "Byline layout: text beside the avatar (horizontal) or stacked under it (vertical — suits centered cover layouts)." },
        "creatorOnSlides": { "enum": ["all", "intro-outro", "first", "none"], "default": "intro-outro" },
        "slides": { "type": "array", "minItems": 1, "items": { "$ref": "#/$defs/slide" } }
    },
    "allOf": [
        {
            "if": { "properties": { "network": { "const": "pinterest" } }, "required": ["network"] },
            "then": {
                "required": ["caption"],
                "properties": {
                    "caption": { "type": "string", "minLength": 1 },
                    "slides": { "maxItems": 1 }
                }
            }
        }
    ],
    "$defs": {
        "audioMix": {
            "type": ["object", "null"], "additionalProperties": false,
            "properties": {
                "voice": { "$ref": "#/$defs/audioTrack" },
                "music": { "$ref": "#/$defs/audioTrack", "description": "Loops to the video end; defaults to volume 0.3." },
                "ducking": { "type": "boolean", "default": true, "description": "Lower music while the voice signal is audible, restoring it during pauses." }
            }
        },
        "audioTrack": {
            "type": "object", "required": ["media"], "additionalProperties": false,
            "properties": {
                "media": { "type": "string", "pattern": "^[a-zA-Z0-9_.-]+\\.(?:[mM][pP]3|[wW][aA][vV]|[mM]4[aA]|[oO][gG][gG]|[fF][lL][aA][cC])(?![\\s\\S])" },
                "volume": { "type": "number", "minimum": 0, "maximum": 1, "description": "Linear gain; 0 mutes, 1 keeps the source level. Voice defaults to 1, music to 0.3." },
                "fadeIn": { "type": "number", "minimum": 0, "maximum": 30, "default": 0, "description": "Fade-in duration in seconds." },
                "fadeOut": { "type": "number", "minimum": 0, "maximum": 30, "default": 0, "description": "Fade-out duration in seconds, ending at the track or video end, whichever is earlier." }
            }
        },
        "palette": {
            "type": "object",
            "additionalProperties": false,
            "properties": {
                "bg": { "$ref": "#/$defs/hex" },
                "text": { "$ref": "#/$defs/hex" },
                "accent": { "$ref": "#/$defs/hex" }
            }
        },
        "counter": {
            "type": "object",
            "additionalProperties": false,
            "properties": {
                "style": { "enum": ["none", "dots", "fraction", "bar"], "default": "fraction" },
                "align": { "enum": ["left", "center", "right"], "default": "right" }
            }
        },
        "slide": {
            "type": "object",
            "additionalProperties": false,
            "properties": {
                "layout": { "enum": ["top", "center", "bottom"], "default": "bottom", "description": "Vertical anchor of the text block." },
                "align": { "enum": ["left", "center", "right"], "default": "left" },
                "tagline": { "type": ["string", "null"] },
                "title": { "type": ["string", "null"] },
                "paragraph": { "type": ["string", "null"] },
                "highlight": { "$ref": "#/$defs/hex", "description": "Paints a rounded marker in this colour behind each title line; omit for none." },
                "swipe": { "type": "boolean", "default": false, "description": "Show a swipe indicator." },
                "overlay": { "type": "number", "minimum": 0, "maximum": 1, "description": "Darken the image behind the text (only valid with an image). Defaults to 0.35 on a slide with an image (0 without) so light text stays readable; set 0 explicitly for no overlay — validate flags low text/background contrast as a warning." },
                "textScale": { "type": "number", "minimum": 0.5, "maximum": 2, "default": 1 },
                "background": { "enum": ["none", "dots", "rings", "waves", "scales", "chevron", "hexagon", "triangles", "plus", "diamonds", "memphis", "sketchy", "paper"], "description": "Overrides the deck's background effect for this slide; omit to inherit the deck effect." },
                "palette": { "$ref": "#/$defs/palette" },
                "imageLayout": { "enum": ["full", "split-v", "split-h"], "default": "full", "description": "How the slide's images fill the frame: one covering it (full), two stacked vertically (split-v) or side by side (split-h). Split layouts require two images." },
                "images": { "type": "array", "items": { "$ref": "#/$defs/image" }, "description": "The slide's background image(s): one for `full`, two for a split layout, each with its own focal point and zoom. (The legacy singular `image` key is still accepted and treated as a one-element list.)" },
                "texts": { "type": "array", "items": { "$ref": "#/$defs/text" }, "description": "Freely positioned text boxes drawn over the layout stack, placed by fractional coordinates so they survive a format change." }
            }
        },
        "text": {
            "type": "object",
            "required": ["content"],
            "additionalProperties": false,
            "properties": {
                "content": { "type": "string", "description": "The text to draw; a \\n makes an explicit line break." },
                "x": { "type": "number", "minimum": 0, "maximum": 1, "default": 0.08, "description": "Left edge of the box, as a fraction of the slide width. x + width must stay ≤ 1." },
                "y": { "type": "number", "minimum": 0, "maximum": 1, "default": 0.08, "description": "Top edge of the box, as a fraction of the slide height." },
                "width": { "type": "number", "minimum": 0.05, "maximum": 1, "default": 0.84, "description": "Wrap width of the box, as a fraction of the slide width." },
                "size": { "type": "number", "minimum": 0.01, "maximum": 0.3, "default": 0.05, "description": "Font size as a fraction of the slide width (0.05 ≈ 54px on a 1080px slide). The text shrinks below this only when it would overflow the slide bottom." },
                "align": { "enum": ["left", "center", "right"], "default": "left", "description": "Horizontal alignment inside the box." },
                "font": { "enum": ["body", "heading"], "default": "body" },
                "color": { "$ref": "#/$defs/hex", "description": "Overrides the slide's text colour; omit to inherit it." },
                "highlight": { "$ref": "#/$defs/hex", "description": "Paints a rounded marker in this colour behind each line; omit for none." }
            }
        },
        "image": {
            "type": "object",
            "required": ["media"],
            "additionalProperties": false,
            "properties": {
                "media": { "type": "string", "description": "Media filename from the site library." },
                "focusX": { "type": "number", "minimum": 0, "maximum": 1, "default": 0.5, "description": "Horizontal focal point kept in frame." },
                "focusY": { "type": "number", "minimum": 0, "maximum": 1, "default": 0.5, "description": "Vertical focal point kept in frame." },
                "zoom": { "type": "number", "minimum": 1, "maximum": 5, "default": 1, "description": "Punch-in relative to cover-fit (1 = fill)." }
            }
        },
        "hex": { "type": "string", "pattern": "^#(?:[0-9a-fA-F]{3}|[0-9a-fA-F]{6})$" }
    }
}
